<?xml version="1.0"?>
<!DOCTYPE note SYSTEM "xml-a.dtd">
<story name="Want to win ?" >

    <step id="0" title="Welcome!">
        <nextStep>1</nextStep>
        <nextStep>3</nextStep>
        <description>First step !</description>
        <type>multiple_choice</type>
    </step>

    <step id="1" title="Welcome!">
        <nextStep>2</nextStep>
        <nextStep>3</nextStep>
        <description>First step !</description>
        <type>multiple_choice</type>
    </step>
    <step id="2" title="End! You loose">
        <description>Dead :(</description>
        <type>end</type>
        <win>false</win>
    </step>
    <step id="3" title="End! You win">
        <nextStep></nextStep>
        <description>win !</description>
        <type>end</type>
        <win>true</win>
    </step>
</story>
